bioproject,title,platform,total_spots,total_bases,study_name,center_name,organism,library_strategy,library_source,library_selection,library_layout,tissue,biosample,run_accessions,tissues,cultivars,time_course_days,library_count_stated,experiment_count_stated,summary
PRJNA1067321,Ri-DT,ILLUMINA,7478760,366459240,RNA seq of BBX18 transgenic plants and WT under control and drought stress,Southwest University,Solanum lycopersicum,RNA-Seq,TRANSCRIPTOMIC,cDNA,SINGLE,6,SAMN39523939,SRR27673320,[],"['BBX18 transgenic plants', 'WT']",0.0,,2,El estudio analiza la secuenciación de RNA en plantas trangenicas BBX18 y en tipo salvaje (WT) bajo condiciones control y estrés por sequía.
PRJNA1221965,"Root transcriptomes, replicate 1",ILLUMINA,23521302,7036090140,Sequencing for drought stress in grafted tomato,Yunnan Academy of Agricultural Sciences,Solanum pennellii,RNA-Seq,TRANSCRIPTOMIC,cDNA,PAIRED,CKR_1,SAMN46759902,SRR32302922,['root'],[],0.0,,1,Este estudio se enfoca en secuenciar transcriptomas de raíz en tomate para estudiar el estrés por sequía.
PRJNA1164923,Transcriptome analysis of drought stressed Solanum lycopersicum cv. MT1,ILLUMINA,47868254,14360476200,Transcriptome analysis of drought stressed Solanum lycopersicum cv. MT1,Universiti Malaya,Solanum lycopersicum,RNA-Seq,TRANSCRIPTOMIC,cDNA,PAIRED,MDR3,SAMN50000014,SRR34564901,['root'],['MT1'],0.0,,1,Se realizó un análisis de transcriptoma en tomate (Solanum lycopersicum) variedad MT1 sometido a estrés por sequía.
PRJNA1100914,GSM8209525: WT_WW_14; Solanum lycopersicum; RNA-Seq,ILLUMINA,31629394,9488818200,Effects of strigolactones on tomato leaf transcriptome under irrigated and repeated water stress conditions,"DISAFA, University of Turin",Solanum lycopersicum,RNA-Seq,TRANSCRIPTOMIC,cDNA,PAIRED,GSM8209525,SAMN40981473,SRR28704512,['leaf'],[],0.0,,1,El estudio analiza el efecto de los strigolactones en la transcriptoma de hojas de tomate bajo condiciones de estrés hídrico con irrigación y repetición.
PRJNA1307411,RNA-seq of upland rice,ILLUMINA,21963101,6588930300,Transcriptome differences in tomato plants induced by drought and PSTVd infection,Ningbo University,Solanum lycopersicum,RNA-Seq,TRANSCRIPTOMIC,cDNA_oligo_dT,PAIRED,MMoc1,SAMN50665768,SRR35022169,['MMoc1'],[],0.0,,1,Se realizó secuenciación de RNA (RNA-seq) en plantas de tomate para estudiar las diferencias transcriptómicas inducidas por sequía y la infección por PSTVd.
PRJEB85881,Raw reads: 3167129_2,ILLUMINA,21674376,2431902094,Time-Resolved Multi-Omics Analysis of Heat Stress Response in Tomato Plants,Leibniz Institute of Plant Genetics and Crop Plant,Solanum lycopersicum,RNA-Seq,TRANSCRIPTOMIC,Oligo-dT,SINGLE,Moneymaker_control_day1_plant2226DP103.1048,SAMEA117696023,ERR14652031,['leaf'],['Moneymaker'],1.0,,1,El estudio analiza la respuesta a estrés por calor en plantas de tomate cultivar Moneymaker mediante un análisis multiómico en el tiempo.
PRJNA1020863,"RNA-Seq of Tetranychus urticae, non-adapted, on tomato, replicate 1",ILLUMINA,14004149,2128630648,"Spider mite adaptation to tomato and strawberry, and effect of drought on plant response.",University of Western Ontario,Tetranychus urticae,RNA-Seq,TRANSCRIPTOMIC,PolyA,PAIRED,10R1,SAMN37531652,SRR26166038,[],[],0.0,,1,"Se realizó secuenciación de RNA (RNA-Seq) para Tetranychus urticae en tomate no adaptado, siendo este el primer réplica del estudio sobre la adaptación del ácaro a diferentes plantas y el efecto de sequía."
PRJDB13627,Illumina MiSeq paired end sequencing of SAMD00492473,ILLUMINA,804953,121747692,Grafting changes epigenetic modifications that lead to drought stress tolerance in tomato plants,TOHOKUGL,Solanum lycopersicum,ChIP-Seq,GENOMIC,ChIP,PAIRED,,SAMD00492473,DRR376880,[],[],0.0,,1,El estudio analiza los cambios epigenéticos inducidos por la enxertia que llevan a una tolerancia al estrés por sequía en plantas de tomate mediante secuenciación ChIP-Seq.
PRJNA1125861,"GSM8338072: Water deficit, Day 10, Young, Rep 3; Solanum lycopersicum; RNA-Seq",DNBSEQ,24164740,4832948000,Integrating Gene Expression Analysis and Ecophysiological Responses to Water Deficit in Leaves of Tomato Plants,Leiden University,Solanum lycopersicum,RNA-Seq,TRANSCRIPTOMIC,cDNA,PAIRED,GSM8338072,SAMN41910874,SRR29464666,['leaf'],[],10.0,,1,El estudio analiza la respuesta de las hojas de tomate a la deficiencia hídrica mediante análisis de expresión génica y respuestas ecofisiológicas.
PRJNA1344858,Tomato leaf WT 3h drought replicate 1,ILLUMINA,21642192,6535941984,Analysis of drought stress response in SlERF4-9 knockout and root-specific overexpression tomato lines,Shihezi University,Solanum lycopersicum,RNA-Seq,TRANSCRIPTOMIC,Oligo-dT,PAIRED,Lib_WTL_D-1,SAMN52655618,SRR35779925,['leaf'],[],0.0,,1,El estudio analiza la respuesta al estrés por sequía en hojas de tomate WT (wild type) como parte de un análisis más amplio sobre líneas knockout y sobrea expresión específica de raíz del gen SlERF4-9.
PRJNA1283911,"RNA-seq of tomato tiny1-23 leaf in irrigation, replicate 1",ILLUMINA,36865520,2469989840,Tomato drought-responsive transcription factor TINY1 suppresses embryonic growth,Hebrew University of Jerusalem-The Robert H. Smith,Solanum lycopersicum,RNA-Seq,TRANSCRIPTOMIC,PolyA,SINGLE,tiny1-23Ir16,SAMN49704257,SRR34288660,['leaf'],[],0.0,,1,Se realizó secuenciación de RNA (RNA-seq) en hojas del tomate con mutación tiny1-23 bajo condiciones de riego específicas.
PRJNA1346947,PR3,ILLUMINA,30185343,9055602900,CDs alleviate oxidative stress in tomato seedlings under water deficit stress,Zhengzhou university,Solanum lycopersicum,RNA-Seq,TRANSCRIPTOMIC,cDNA,PAIRED,library 6,SAMN52845686,SRR35827462,['seedling'],[],0.0,,1,El estudio analiza cómo los compuestos disipadores de energía (CDs) alivian el estrés oxidativo en plántulas de tomate bajo estrés por déficit hídrico.
PRJNA1172730,"GSM8571232: Mock, 100FC, biol rep 3; Solanum lycopersicum; RNA-Seq",ILLUMINA,27143304,8142991200,"Effect of Penicillium chrysogenum, Penicillium minioluteum, and Serendipita indica on gene expression in Solanum lycopersicum plants under control and drought stress conditions","Pollmann Lab, Centro de Biotecnología y Genómica d",Solanum lycopersicum,RNA-Seq,TRANSCRIPTOMIC,cDNA,PAIRED,GSM8571232,SAMN44280364,SRR31025479,[],['Solanum lycopersicum'],0.0,,1,"El estudio analiza la expresión génica en plantas de tomate (Solanum lycopersicum) bajo condiciones control y estrés por sequía, después de la exposición a Penicillium chrysogenum, Penicillium minioluteum y Serendipita indica."
PRJEB83804,Raw reads: PSLS3,ILLUMINA,21465362,6439608600,Physiological and molecular insights into the effect of a seaweed biostimulant on enhancing fruit yield and drought tolerance in tomato,Center of Plant Systems Biology and Biotechnology,,RNA-Seq,TRANSCRIPTOMIC,PolyA,PAIRED,,SAMEA117551092,ERR14098240,[],[],0.0,,1,El estudio busca comprender los efectos de un biostimulante de alga marina en el rendimiento frutal y la tolerancia a sequía en tomate mediante análisis fisiológicos y moleculares.
PRJNA1366651,RNA-Seq of tomato roots: seedling,ILLUMINA,25925705,7763146958,SlTPP1 enhances drought tolerance in tomato,Chinese Academy of Agricultural Sciences,Solanum lycopersicum,RNA-Seq,TRANSCRIPTOMIC,RT-PCR,PAIRED,8PM_OE_TPP1_1,SAMN35713430,SRR36140176,['root'],[],0.0,,1,El estudio analiza la expresión génica en raíces de tomate mediante RNA-Seq para evaluar cómo SlTPP1 mejora la tolerancia a sequía.
PRJNA1298269,"GSM9139265: RNAseq, ultrasound+drought, rep3; Solanum lycopersicum; RNA-Seq",ILLUMINA,52868144,15860443200,Transcriptional memory of tomato plants using ultrasound and drought stress stimuli [RNA-seq],Centre for Agricultural Genomics and Biotechnology,Solanum lycopersicum,RNA-Seq,TRANSCRIPTOMIC,cDNA,PAIRED,GSM9139265,SAMN50268820,SRR34763505,['leaf'],[],0.0,,1,El estudio analiza la respuesta transcriptómica de tomate (Solanum lycopersicum) a estímulos ultrasónicos y estrés por sequía mediante secuenciación de RNA.
PRJNA1013493,Transcriptomic analysis uncovers the regulatory role of SlHB8 in the drought resistance of tomato,ILLUMINA,24410156,7323046800,Transcriptomic analysis uncovers the regulatory role of SlHB8 in the drought resistance of tomato,South China Agricultural University,Solanum lycopersicum,RNA-Seq,TRANSCRIPTOMIC,Oligo-dT,PAIRED,9,SAMN37299453,SRR25937732,"['root', 'leaf']",[],0.0,,1,El estudio transcriptómico busca descubrir el papel regulador de SlHB8 en la resistencia al estrés hídrico del tomate.
PRJNA1100410,The AZ transcriptome of tomato pedicels in sr3l mutant drought treatment for 7 days,ILLUMINA,32412219,9723665700,The AZ transcriptome of tomato pedicels in sr3l mutant drought treatment for 7 days,shenyang agriculture university,Solanum lycocarpum,RNA-Seq,TRANSCRIPTOMIC,cDNA,PAIRED,sr3l3,SAMN40940344,SRR28680732,['pedicel'],[],7.0,,1,El estudio analiza la transcriptoma del pedicelo de tomate en el mutante sr3l bajo tratamiento de sequía durante 7 días.
PRJNA1063168,leaves of OE_12_2 under drought,ILLUMINA,23061627,6918488100,RNA-seq of tomato leaf,Huazhong Agricultural University,Solanum lycopersicum,RNA-Seq,TRANSCRIPTOMIC,RT-PCR,SINGLE,OE_12_2,SAMN39327937,SRR27476732,['leaf'],[],0.0,,1,Se realizó secuenciación de RNA (RNA-seq) en hojas de tomate bajo estrés por sequía.
PRJNA1304149,RNS-Seq of tomato: leaves,ILLUMINA,19758807,2441695148,Tomato treated with biostimulants against drought stress,Hungarian University of Agricultural and Life Scie,Solanum lycopersicum,RNA-Seq,TRANSCRIPTOMIC,cDNA,SINGLE,SA_HA_drought_stressed_F,SAMN50550020,SRR34939862,['leaf'],[],0.0,,1,Se realizó secuenciación de RNA (RNA-Seq) en hojas de tomate sometidas a estrés por sequía con el uso de biostimulantes.
PRJNA1003008,DM82_1,ILLUMINA,21730163,6519048900,Solanum lycopersicum Raw sequence reads,Foshan University,Solanum lycopersicum,RNA-Seq,TRANSCRIPTOMIC,cDNA,PAIRED,DM82_1,SAMN36869021,SRR25558588,['DM82_1'],[],0.0,,1,El estudio proporciona secuencias brutas de RNA-Seq del tomate (Solanum lycopersicum) con el fin de analizar la transcriptoma en un tejido específico identificado como DM82_1.
PRJDB15063,Illumina HiSeq 4000 sequencing of SAMD00570690,ILLUMINA,20984238,2119408038,Evolution of two gene networks underlying adaptation to drought tolerance in the wild tomato Solanum chilense,KHAZAR,Solanum chilense,RNA-Seq,TRANSCRIPTOMIC,Oligo-dT,SINGLE,S.chilense_LA1963_16,SAMD00570690,DRR437021,['leaf'],[],0.0,,1,Se realizó secuenciación de RNA-Seq en hojas del tomate silvestre Solanum chilense para estudiar la evolución de dos redes génicas que subyacen a la adaptación a la tolerancia al estrés hídrico.
PRJNA947261,RNA-Seq of tomato leaves after 4h dehydration,ILLUMINA,22545892,6763767600,Transcripome data of tomato leaves under control and drought conditions,Jiangsu Academy of Agricultural Sciences,Solanum lycopersicum,RNA-Seq,TRANSCRIPTOMIC,RANDOM,PAIRED,D-4h-3,SAMN33846763,SRR23959349,['leaf'],[],0.1667,,1,Se realizó secuenciación de RNA (RNA-Seq) en hojas de tomate después de 4 horas de sequía.
PRJNA931112,Lucariello_Dr1,ILLUMINA,38160086,3854168686,Tomato Corbarino e Lucariello landraces upon drought,Universita Federico II di Napoli,Solanum lycopersicum,RNA-Seq,TRANSCRIPTOMIC,unspecified,SINGLE,24_CCGTCC_L008_R1_001.fastq,SAMN33047057,SRR23329160,[],"['Corbarino', 'Lucariello']",0.0,,1,El estudio analiza la respuesta a sequía en variedades locales de tomate (Solanum lycopersicum) llamadas Corbarino y Lucariello.
PRJNA905675,R2 Trichoderma inoculated + water deficit stress,ILLUMINA,13906600,4008611269,Solanum lycopersicum Transcriptome,The Ohio State University,Solanum lycopersicum,RNA-Seq,TRANSCRIPTOMIC,cDNA,PAIRED,C_BP_7_V1C_1,SAMN31881071,SRR22671589,['root'],[],0.0,,1,El estudio analiza la transcriptoma de Solanum lycopersicum en respuesta a la inoculación con Trichoderma y el estrés por déficit hídrico.
PRJNA905679,GSM6756952: green stage tomato_control_3; Solanum lycopersicum; miRNA-Seq,ILLUMINA,46816094,2387620794,Genes related to cell wall metabolisms are targeted by miRNAs in immature tomato fruits under drought stress,"Taste Science, Applied Biological Chemistry Gradua",Solanum lycopersicum,miRNA-Seq,TRANSCRIPTOMIC,size fractionation,SINGLE,GSM6756952,SAMN31880857,SRR22415002,['fruit'],[],0.0,,1,El estudio analiza la relación entre los genes relacionados con la metabolización de la pared celular y los miRNAs en frutos inmaduros de tomate bajo estrés por sequía.
PRJNA875390,"GSM6529488: M82 root, replicate 2, scRNAseq; Solanum lycopersicum; RNA-Seq",ILLUMINA,381743424,115286514048,Single cell data: suberized exodermis is required for tomato drought tolerance,"Plant Biology and Genome Center, UC Davis",Solanum lycopersicum,RNA-Seq,TRANSCRIPTOMIC SINGLE CELL,cDNA,PAIRED,GSM6529488,SAMN30615197,SRR21376774,['root'],['M82'],0.0,,1,El estudio analiza datos de secuenciación de RNA a nivel individual de células en raíz del tomate cultivar M82 para investigar la tolerancia al estrés hídrico.
PRJNA875392,"GSM6529494: Roots, protoplasted, rep 3; Solanum lycopersicum; RNA-Seq",ILLUMINA,10079070,3043879140,Protoplast data: suberized exodermis is required for tomato drought tolerance,"Plant Biology and Genome Center, UC Davis",Solanum lycopersicum,RNA-Seq,TRANSCRIPTOMIC,cDNA,PAIRED,GSM6529494,SAMN30615191,SRR21375712,['root'],[],0.0,,1,El estudio analiza datos de RNA-Seq de raíces de tomate (Solanum lycopersicum) para investigar la tolerancia al estrés hídrico en relación con una exodermis suberizada.
PRJNA869132,leaves of WT 2 under drought,ILLUMINA,20981678,6294503400,Tomato FMO1 transgenic plant RNA-Seq data,Southwest university,Solanum lycopersicum,RNA-Seq,TRANSCRIPTOMIC,cDNA,PAIRED,DT WT2,SAMN30287738,SRR21031282,['leaf'],[],0.0,,1,El estudio analiza la secuenciación de ARN en hojas de plantas transgénicas de tomate bajo estrés por sequía.
PRJNA855575,T270_CombinedStress_root_rep1,ILLUMINA,52761774,15934055748,Tomato root leaf sequencing,National Research Council of Italy,Solanum lycopersicum,RNA-Seq,TRANSCRIPTOMIC,PolyA,PAIRED,RNAseq of S lycopersicum: T270root_combined stress_rep1,SAMN29496390,SRR19976100,['root'],[],0.0,,1,El estudio se enfoca en la secuenciación de ARN de raíz de tomate bajo estrés combinado.
PRJNA853266,Pl_RR_S1_1,ILLUMINA,12162957,1033851345,Spatiotemporal dynamics of the tomato fruit transcriptome under prolonged water stress,Cornell University,Solanum lycopersicum,RNA-Seq,TRANSCRIPTOMIC,RANDOM,SINGLE,Pl_RR_S1_1,SAMN29373548,SRR19886499,['Pl_RR_S1_1'],[],0.0,,1,El estudio analiza la dinámica espaciotemporal de la transcriptoma del fruto de tomate bajo estrés hídrico prolongado.
PRJNA817851,lncRNA-seq of tomato anther,ILLUMINA,43718570,13115571000,Long non-coding RNA transcriptome of tomato anthers in response to drought stress,Zhejiang University,Solanum lycopersicum,ncRNA-Seq,TRANSCRIPTOMIC,Inverse rRNA,PAIRED,A3S_1,SAMN26810525,SRR18367152,['anther'],[],0.0,,1,Se secuenció el transcriptoma de ncRNA en anteras de tomate en respuesta al estrés por sequía.
PRJNA812356,no melatonin treatment with drough 10days,ILLUMINA,45949065,2297453250,tomato transcriptome,Anhui Normal University,Solanum lycopersicum,RNA-Seq,TRANSCRIPTOMIC,PCR,SINGLE,CM10,SAMN26376181,SRR18242837,['CM10'],[],10.0,,1,El estudio analiza la transcriptoma de tomate bajo estrés por sequía sin tratamiento con melatonina durante 10 días.
PRJNA800740,"RNAseq on S. lycopersicum in drought condition at day 5, replicate 1",ILLUMINA,12693134,1269313400,RNAseq in tomato under water stress,CSIC,Solanum lycopersicum,RNA-Seq,TRANSCRIPTOMIC,PolyA,SINGLE,M82_D_D5_rep1,SAMN25279274,SRR17762425,[],['M82'],5.0,,1,Se realizó secuenciación de RNA en tomate bajo estrés hídrico en el día 5 para la replicación 1.
PRJNA753098,"Solanum lycopersicum, M82, mature leaf, drought treatment, biological replicate 1, M82_DB, Illumina Stranded mRNA Prep Ligation with IDT for Illumina RNA UD Indexes Set A, index UDP0008 (GATCAAGGCA-CCTTGTTAAT)",ILLUMINA,58223657,5822365700,"Whole genome sequencing and transcriptome sequencing of Solanum lycopersicum, M82",University of Georgia,Solanum lycopersicum,RNA-Seq,TRANSCRIPTOMIC,RANDOM,PAIRED,M82_DB,SAMN20970598,SRR15607541,['leaf'],['M82'],0.0,,1,"Se realizó secuenciación de transcriptoma para el cultivo vegetal Solanum lycopersicum M82 bajo tratamiento de sequía, con réplica biológica 1."
PRJNA745152,GHMM_2,ILLUMINA,24240754,7320707708,Physiological and transcriptomic analyses of the effects of SlBRI1 expression levels on the drought tolerance of tomato seedlings,China West Normal University,Solanum lycopersicum,RNA-Seq,TRANSCRIPTOMIC,other,PAIRED,GHMM_2.R1.fastq.gz,SAMN20147507,SRR15244997,[],[],0.0,,1,El estudio analiza los efectos de los niveles de expresión de SlBRI1 en la tolerancia al estrés hídrico en plántulas de tomate mediante análisis fisiológicos y transcriptómicos.
PRJNA746070,plant transcriptomic,ILLUMINA,44481314,13344394200,Morpho-Physiological and Transcriptome Changes in Tomato Anthers of Different Developmental Stages Under Drought Stress,zhejiang university,Solanum lycopersicum,RNA-Seq,TRANSCRIPTOMIC,PolyA,PAIRED,drought stressed-TED-VUM-3,SAMN20179786,SRR15111729,['anther'],[],0.0,,1,El estudio analiza los cambios morfo-fisiológicos y transcriptómicos en las anteras de tomate en diferentes etapas de desarrollo bajo estrés por sequía.
PRJNA734743,SL RKN7_1,ILLUMINA,4007622,300571650,Response to drought stress in tomato roots during the interaction with the root-knot nematode,Consiglio Nazionale delle Ricerche,Solanum lycopersicum,RNA-Seq,TRANSCRIPTOMIC,cDNA,SINGLE,RKN7_1 26987_ID1062_3_S3_L002,SAMN19523120,SRR14736086,['root'],[],0.0,,1,El estudio analiza la respuesta del tomate a estrés por sequía en las raíces durante la interacción con el nematodo de nudos.
PRJEB42547,Illumina NovaSeq 6000 paired end sequencing,ILLUMINA,25939137,7781741100,TRANSCRIPTOMIC PROFILING OF GENES INVOLVED IN INDUCED DROUGHT TOLERANCE CONFERRED BY PSEUDOMONAS PUTIDA SAESo11,Aristotle University of Thessaloniki,Solanum lycopersicum,RNA-Seq,TRANSCRIPTOMIC,cDNA,PAIRED,unspecified,SAMEA7839032,ERR5106721,[],[],0.0,,1,Se realizó secuenciación de RNA-Seq en tomate (Solanum lycopersicum) para estudiar el perfil transcriptómico involucrado en la tolerancia a sequía inducida por Pseudomonas putida SAESo11.
PRJNA691997,RD-1,ILLUMINA,41336596,12483651992,Transcriptome sequencing reveals the effects of green light on tomato drought tolerance,Nottingham Trent University,Solanum lycopersicum,RNA-Seq,TRANSCRIPTOMIC,RANDOM,PAIRED,library10,SAMN17311825,SRR13435467,['leaf'],[],0.0,,1,El estudio analiza los efectos de la luz verde en la tolerancia a sequía del tomate mediante secuenciación transcriptómica.
PRJNA670031,RNA-Seq of not and WT tomato,BGISEQ,24068644,1203432200,Tomato roots growth adaptation to drought,Fujian Agriculture and Forestry University,Solanum lycopersicum,RNA-Seq,TRANSCRIPTOMIC,RANDOM PCR,SINGLE,IIWN-1,SAMN16482362,SRR12846199,['root'],[],0.0,,1,Se realizó secuenciación de RNA (RNA-Seq) en raíces de tomate para estudiar la adaptación al estrés por sequía.
PRJNA657834,GSM4730211: Vein_T0_Watered_2; Solanum lycopersicum; RNA-Seq,ILLUMINA,10629948,797246100,Vein and Intervein Drought RNAseq,GEO,Solanum lycopersicum,RNA-Seq,TRANSCRIPTOMIC,cDNA,SINGLE,,SAMN15848056,SRR12467589,[],[],0.0,,1,El estudio analiza la expresión génica en tejidos de Solanum lycopersicum utilizando RNA-Seq.
PRJNA644769,RNA-Seq of Solanum lycopericum: leaf,ILLUMINA,40273414,4067614814,Trichoderma-mediated transcriptional reprogramming affects tomato response to water stress,National Research Council,Solanum lycopersicum,RNA-Seq,TRANSCRIPTOMIC,RANDOM PCR,SINGLE,Pool4_T+P,SAMN15589917,SRR12278649,['leaf'],[],0.0,,1,El estudio analiza la reprogramación transcriptómica en tomate mediada por Trichoderma bajo estrés hídrico mediante secuenciación de RNA.
PRJNA644865,RNA-Seq of Solanum lycopersicum : LA0147 Control Leaf,ILLUMINA,32113962,8560227289,Transcriptome variation under drought stress in 8 accessions of tomato.,INRA,Solanum lycopersicum,RNA-Seq,TRANSCRIPTOMIC,Oligo-dT,PAIRED,LA0147 Control Leaf,SAMN15480629,SRR12172675,['leaf'],[],0.0,,1,Se realizó secuenciación de RNA (RNA-Seq) en hojas control del acceso LA0147 de tomate para estudiar variaciones transcriptómicas bajo estrés por sequía.
PRJNA635375,GSM4570205: Heat-Recovery-3; Solanum lycopersicum; RNA-Seq,ILLUMINA,26768409,8030522700,Transcription profiles of tomato (Solanum lycopersicum) seedlings response to drought and heat stress,GEO,Solanum lycopersicum,RNA-Seq,TRANSCRIPTOMIC,cDNA,PAIRED,,SAMN15032867,SRR11855665,[],[],0.0,,1,El estudio analiza el perfil de transcripción en plántulas de tomate (Solanum lycopersicum) en respuesta al estrés por sequía y calor.
PRJNA634438,RNA-seq of Solanum lycopersicum:drought,ILLUMINA,31610884,9330970900,Transcription profiles of tomato (Solanum lycopersicum) seedlings response to drought and heat stress,Northwest A&F University,Solanum lycopersicum,RNA-Seq,TRANSCRIPTOMIC,PCR,PAIRED,D-3d-1,SAMN14996384,SRR11829536,"['root', 'leaf']",[],3.0,,1,El estudio analiza el perfil de transcripción en plántulas de tomate (Solanum lycopersicum) en respuesta al estrés por sequía.
PRJNA624892,GSM4473211: EX63_6h; Solanum lycopersicum; RNA-Seq,BGISEQ,42921168,6438175200,Comparative transcriptome analysis between two tomato materials under drought stress,GEO,Solanum lycopersicum,RNA-Seq,TRANSCRIPTOMIC,cDNA,PAIRED,,SAMN14588851,SRR11539307,[],[],0.0,,1,El estudio analiza la transcriptoma comparativa entre dos materiales de tomate bajo estrés por sequía.
PRJNA602474,"GSM4277884: Guard cells, pro17_3_pro∆19; Solanum lycopersicum; RNA-Seq",ILLUMINA,23391924,1426907364,The role of DELLA protein in tomato plant response to water-deficit stress,GEO,Solanum lycopersicum,RNA-Seq,TRANSCRIPTOMIC,cDNA,SINGLE,,SAMN13895826,SRR10919113,[],[],0.0,,1,El estudio analiza el papel del proteína DELLA en la respuesta de las células guardiola de tomate a estrés por déficit hídrico.
PRJNA592330,RNAseq of tomato leaves: SF_+_water_S2 rep1,ILLUMINA,20259722,1519479150,Priming with an Ascophyllum nodosum extract improves drought tolerance in tomato,University of Potsdam,Solanum lycopersicum,RNA-Seq,TRANSCRIPTOMIC,unspecified,SINGLE,SF_+_water_S2 rep1,SAMN13422038,SRR10550626,['leaf'],[],0.0,,1,Se realizó secuenciación de RNA en hojas de tomate tratadas con un extracto de Ascophyllum nodosum y agua.
PRJNA573482,RNA-seq of tomato: six-week-old plant,ILLUMINA,33558061,10067418300,Regulation role of SlNPR1 in tomato plant drought tolerance,China Agricultural University,Solanum lycopersicum,RNA-Seq,TRANSCRIPTOMIC,PCR,PAIRED,WT-drought1,SAMN12816847,SRR10192964,"['root', 'leaf']",[],0.0,,1,El estudio analiza el papel regulador de SlNPR1 en la tolerancia a sequía en plantas de tomate.
PRJNA545411,RNA-seq of Solanum lycopersicum roots,ILLUMINA,16586731,829336550,Transcriptomic responses to water deficit and nematode infection in mycorrhizal tomato roots,Consiglio Nazionale delle Ricerche,Solanum lycopersicum,RNA-Seq,TRANSCRIPTOMIC,cDNA,SINGLE,AM_WS,SAMN11891232,SRR9158277,['root'],[],0.0,,1,El estudio analiza la respuesta transcriptómica en las raíces de tomate sometidas a déficit hídrico e infección por nematodos.
PRJNA495618,GSM3425894: Combination_3 (circRNA); Solanum lycopersicum; ncRNA-Seq,ILLUMINA,23370988,6854442806,"Genome wide identification of circRNAs, miRNAs and their targets in tomatoes at heat, drought and their combination",GEO,Solanum lycopersicum,ncRNA-Seq,TRANSCRIPTOMIC,size fractionation,PAIRED,,SAMN10228532,SRR7994084,[],[],0.0,,1,"El estudio busca identificar circRNAs, miRNAs y sus targets en tomates bajo condiciones de estrés térmico, sequía y su combinación."
PRJNA484882,low temperature and drought 1,ILLUMINA,26345847,7867973942,Transcriptome of low temperature and drought in tomato,Jiangsu Academy of Agricultural Science,Solanum lycopersicum,RNA-Seq,TRANSCRIPTOMIC,RANDOM,PAIRED,low temperature and drought 1,SAMN09771600,SRR7652562,[],[],0.0,,1,El estudio analiza la transcriptoma de tomate bajo condiciones de baja temperatura y sequía.
PRJNA472702,"RNA-Seq of Solanum lycopersicum : Cervil, Control, Fruit",ILLUMINA,47524176,12388940671,Transcriptome variation under drought stress in tomato,INRA,Solanum lycopersicum,RNA-Seq,TRANSCRIPTOMIC,Oligo-dT,PAIRED,"Cervil, Control, Fruit",SAMN09241293,SRR7206494,"['Cervil', 'Control', 'Fruit']",[],0.0,,3,El estudio analiza la variación del transcriptoma en tomate bajo estrés por sequía mediante secuenciación de RNA-Seq en diferentes tejidos.
PRJNA395638,RNAseq of Solanum lycopersicum: leaf tissue,ABI_SOLID,6723978,336198900,Solanum lycopersicum Raw sequence reads,Universiy of Valencia,Solanum lycopersicum,RNA-Seq,TRANSCRIPTOMIC,size fractionation,SINGLE,PSI2,SAMN07411918,SRR5865241,['leaf'],[],0.0,,1,Se secuenció la expresión génica de tejido foliar en tomate (Solanum lycopersicum) utilizando el método RNA-Seq.
PRJNA386540,miRNA of M82 drought,ILLUMINA,12182740,609137000,Solanum lycopersicum Transcriptome or Gene expression,Huazhong Agricultural University,Solanum lycopersicum,miRNA-Seq,TRANSCRIPTOMIC,RT-PCR,SINGLE,miRNA-SD,SAMN06972330,SRR5556642,[],['M82'],0.0,,1,El estudio analiza la expresión de microARN en el cultivo M82 bajo condiciones de sequía.
PRJNA338277,Transcription in roots of tomato near-isogenic lines in response to rapid-onset water stress ,ILLUMINA,59462541,2973127050,Solanum lycopersicum Transcriptome or Gene expression,BioCI,Solanum lycopersicum,RNA-Seq,TRANSCRIPTOMIC,cDNA,SINGLE,1.55a,SAMN05544947,SRR4014827,['root'],[],0.0,,1,El estudio analiza la transcripción en las raíces de líneas casi isogénicas de tomate en respuesta al estrés hídrico de rápida aparición.
